{
    "icon": "temaki-playhouse",
    "geometry": [
        "point",
        "area"
    ],
    "fields": [
        "{playground}"
    ],
    "moreFields": [
        "{playground}"
    ],
    "tags": {
        "playground": "playhouse"
    },
    "terms": [
        "children's house",
        "playground house",
        "playhouse"
    ],
    "name": "Play House",
    "aliases": [
        "Wendy House"
    ]
}
