{
    "icon": "fas-venus",
    "geometry": [
        "point",
        "area"
    ],
    "terms": [
        "egg",
        "gynaecologist",
        "gynaecology",
        "gynecology",
        "ob/gyn",
        "obgyn",
        "obstetrics",
        "ovulation",
        "reproductive",
        "woman's doctor",
        "women's doctor"
    ],
    "fields": [
        "{amenity/doctors}"
    ],
    "moreFields": [
        "{amenity/doctors}"
    ],
    "tags": {
        "amenity": "doctors",
        "healthcare:speciality": "gynaecology"
    },
    "addTags": {
        "amenity": "doctors",
        "healthcare:speciality": "gynaecology",
        "healthcare": "doctor"
    },
    "reference": {
        "key": "healthcare:speciality",
        "value": "gynaecology"
    },
    "name": "Obstetrician / Gynecologist",
    "aliases": [
        "Gynecologist",
        "Obstetrician"
    ]
}
