{
    "icon": "roentgen-sinking_ship",
    "fields": [
        "name",
        "access_simple",
        "seamark/wreck/category",
        "historic/wreck/date_sunk",
        "historic/wreck/visible_at_low_tide",
        "historic/wreck/visible_at_high_tide"
    ],
    "moreFields": [
        "{historic}",
        "seamark/type"
    ],
    "geometry": [
        "point",
        "area"
    ],
    "tags": {
        "historic": "wreck"
    },
    "addTags": {
        "historic": "wreck",
        "seamark:type": "wreck"
    },
    "terms": [
        "boat",
        "hull",
        "maritime",
        "mast",
        "remains",
        "ship"
    ],
    "name": "Shipwreck"
}
