{
    "icon": "roentgen-vending_candy",
    "geometry": [
        "point",
        "vertex"
    ],
    "terms": [
        "gumball"
    ],
    "fields": [
        "{amenity/vending_machine}"
    ],
    "moreFields": [
        "{amenity/vending_machine}"
    ],
    "tags": {
        "amenity": "vending_machine",
        "vending": "sweets"
    },
    "reference": {
        "key": "vending",
        "value": "sweets"
    },
    "name": "Candy Vending Machine"
}
