{
    "icon": "roentgen-person_throwing_spear",
    "geometry": [
        "area",
        "point"
    ],
    "fields": [
        "{leisure/pitch/athletics}"
    ],
    "moreFields": [
        "{leisure/pitch/athletics}"
    ],
    "tags": {
        "leisure": "pitch",
        "sport": "athletics",
        "athletics": "javelin_throw"
    },
    "reference": {
        "key": "athletics",
        "value": "javelin_throw"
    },
    "name": "Javelin Sector"
}
