{
    "icon": "temaki-bicycle_parked",
    "fields": [
        "bicycle_parking",
        "capacity",
        "operator",
        "operator/type",
        "covered",
        "access_simple",
        "fee",
        "payment_multi_fee",
        "charge_fee"
    ],
    "moreFields": [
        "bike_ride",
        "colour",
        "indoor",
        "level",
        "lit"
    ],
    "geometry": [
        "point",
        "vertex",
        "line",
        "area"
    ],
    "terms": [
        "bike",
        "bike parking",
        "bike rack",
        "bike stands",
        "cycle parking",
        "cycling"
    ],
    "tags": {
        "amenity": "bicycle_parking"
    },
    "name": "Bicycle Parking"
}
