{
    "icon": "iD-highway-secondary",
    "fields": [
        "{highway/primary}"
    ],
    "moreFields": [
        "{highway/primary}"
    ],
    "geometry": [
        "line"
    ],
    "tags": {
        "highway": "secondary"
    },
    "terms": [
        "road",
        "street"
    ],
    "name": "Secondary Road",
    "matchScore": 1.01
}
