{
    "icon": "roentgen-mini_bumps",
    "tags": {
        "traffic_calming": "mini_bumps"
    },
    "geometry": [
        "vertex"
    ],
    "fields": [
        "surface",
        "direction_vertex"
    ],
    "terms": [
        "bumps",
        "circular bumps",
        "circular speed bumps",
        "slow",
        "small bumps",
        "small speed bumps",
        "speed",
        "traffic calming"
    ],
    "name": "Mini Speed Bumps"
}
