{
    "icon": "temaki-speedway_oval",
    "fields": [
        "name",
        "oneway",
        "surface",
        "sport/sport_racing_motor",
        "lit",
        "width",
        "lanes",
        "structure"
    ],
    "geometry": [
        "line",
        "area"
    ],
    "tags": {
        "highway": "raceway"
    },
    "name": "{highway/raceway}",
    "searchable": false
}
