{
    "icon": "roentgen-apartments_1_story",
    "geometry": [
        "area"
    ],
    "fields": [
        "{building}"
    ],
    "moreFields": [
        "{building}"
    ],
    "tags": {
        "building": "outbuilding"
    },
    "matchScore": 0.5,
    "name": "Outbuilding",
    "searchable": false
}
