{
    "icon": "pinhead-bagel_seeded",
    "geometry": [
        "point",
        "area"
    ],
    "terms": [
        "breakfast",
        "lox"
    ],
    "fields": [
        "{amenity/fast_food}"
    ],
    "moreFields": [
        "{amenity/fast_food}"
    ],
    "tags": {
        "amenity": "fast_food",
        "cuisine": "bagel"
    },
    "reference": {
        "key": "cuisine",
        "value": "bagel"
    },
    "name": "Bagel Fast Food"
}
