{
    "icon": "roentgen-barrier_jersey",
    "fields": [
        "height",
        "material"
    ],
    "moreFields": [
        "access"
    ],
    "geometry": [
        "vertex",
        "line"
    ],
    "tags": {
        "barrier": "jersey_barrier"
    },
    "terms": [
        "concrete barrier",
        "concrete median",
        "constant-slope barrier",
        "f-shape barrier",
        "k-rail",
        "median",
        "new jersey wall",
        "ontario tall wall",
        "plastic barrier"
    ],
    "name": "Jersey Barrier"
}
