{
    "icon": "temaki-vending_cold_drink",
    "fields": [
        "vending",
        "{amenity/vending_machine}"
    ],
    "moreFields": [
        "{amenity/vending_machine}"
    ],
    "geometry": [
        "point",
        "vertex"
    ],
    "terms": [
        "aqua",
        "drinking water",
        "potable water",
        "water"
    ],
    "tags": {
        "amenity": "vending_machine",
        "vending": "water"
    },
    "reference": {
        "key": "vending",
        "value": "water"
    },
    "name": "Drinking Water Vending Machine"
}
