{
    "icon": "roentgen-full_height_turnstile",
    "fields": [
        "access"
    ],
    "moreFields": [
        "{barrier}"
    ],
    "geometry": [
        "vertex"
    ],
    "terms": [
        "baffle gate",
        "turnstyle"
    ],
    "tags": {
        "barrier": "full-height_turnstile"
    },
    "name": "Full-Height Turnstile"
}
