{
    "icon": "fas-shopping-cart",
    "fields": [
        "deposit/trolley",
        "payment_multi_fee"
    ],
    "moreFields": [
        "brand",
        "covered",
        "fee",
        "indoor",
        "opening_hours",
        "operator"
    ],
    "geometry": [
        "point",
        "area"
    ],
    "tags": {
        "amenity": "trolley_bay"
    },
    "terms": [
        "carriage return",
        "cart return",
        "shopping cart",
        "trolley bay"
    ],
    "name": "Cart Corral"
}
