{
    "icon": "roentgen-vending_flower",
    "fields": [
        "vending",
        "{amenity/vending_machine}"
    ],
    "moreFields": [
        "{amenity/vending_machine}"
    ],
    "geometry": [
        "point",
        "vertex"
    ],
    "terms": [
        "bouquet",
        "flower"
    ],
    "tags": {
        "amenity": "vending_machine",
        "vending": "flowers"
    },
    "reference": {
        "key": "vending",
        "value": "flowers"
    },
    "name": "Flower Vending Machine"
}
